{"dossier_id":"case-dossier-1","title":"Directly edited without a new digest","objective":"Keep artifact current","scope":{"in":["artifact.txt"],"out":["deployment"]},"constraints":["local-only"],"acceptance_criteria":[{"criterion_id":"criterion-a","statement":"Artifact digest matches","verification":"mechanical"}],"state_revision":"0","state_digest":"sha256:c8fdd08bc12368f98d3aaa736d1bc1057d07ea18aba6b549a6039021205c175d","last_operation":null,"active_run":{"run_id":"case-run-1","actor_id":"actor-a","started_by_handoff_id":null},"evidence":[],"current_handoff_id":null,"current_submission_id":null,"current_decision_id":null}
