{"dossier_id":"case-dossier-1","title":"Release integrity","objective":"Keep artifact current","scope":{"in":["artifact.txt"],"out":["deployment"]},"constraints":["local-only"],"acceptance_criteria":[{"criterion_id":"criterion-a","statement":"Artifact digest matches","verification":"mechanical"}],"state_revision":"1","state_digest":"sha256:480d286250d16fef105a38be6f95aeadab6ad15a78ba791fbb952d8b142278af","last_operation":{"operation_id":"op-submission-current","input_digest":"sha256:db8c5f0de9a6c086b34a29388e40acd77c2c11fc04e836dc79a11f952e9a6d3f","basis_revision":"0","resulting_revision":"1"},"active_run":{"run_id":"case-run-1","actor_id":"actor-a","started_by_handoff_id":null},"evidence":[],"current_handoff_id":null,"current_submission_id":"submission-current","current_decision_id":null}
