{"dossier_id":"case-dossier-1","title":"Huge title 🧪🧪🧪🧪🧪🧪🧪🧪🧪🧪🧪🧪🧪🧪🧪🧪🧪🧪🧪🧪🧪🧪🧪🧪🧪🧪🧪🧪🧪🧪🧪🧪🧪🧪🧪🧪🧪🧪🧪🧪🧪🧪🧪🧪🧪🧪🧪🧪🧪🧪🧪🧪🧪🧪🧪🧪🧪🧪🧪🧪🧪🧪🧪🧪🧪🧪🧪🧪🧪🧪🧪🧪🧪🧪🧪🧪🧪🧪🧪🧪🧪🧪🧪🧪🧪🧪🧪🧪🧪🧪🧪🧪🧪🧪🧪🧪🧪🧪🧪🧪🧪🧪🧪🧪🧪🧪🧪🧪🧪🧪🧪🧪🧪🧪🧪🧪🧪🧪🧪🧪🧪🧪🧪🧪🧪🧪🧪🧪🧪🧪🧪🧪🧪🧪🧪🧪🧪🧪🧪🧪🧪🧪🧪🧪🧪🧪🧪🧪🧪🧪🧪🧪🧪🧪🧪🧪🧪🧪🧪🧪🧪🧪🧪🧪🧪🧪🧪🧪🧪🧪🧪🧪🧪🧪🧪🧪🧪🧪🧪🧪🧪🧪🧪🧪🧪🧪🧪🧪🧪🧪🧪🧪🧪🧪🧪🧪🧪🧪🧪🧪🧪🧪🧪🧪🧪🧪🧪🧪🧪🧪🧪🧪🧪🧪🧪🧪🧪🧪🧪🧪🧪🧪🧪🧪🧪🧪🧪🧪🧪🧪🧪🧪🧪🧪🧪🧪🧪🧪🧪🧪🧪🧪🧪🧪🧪🧪🧪🧪🧪🧪🧪🧪🧪🧪🧪🧪🧪🧪🧪🧪🧪🧪🧪🧪🧪🧪🧪🧪🧪🧪🧪🧪🧪🧪🧪🧪🧪🧪🧪🧪🧪🧪🧪🧪🧪🧪🧪🧪🧪🧪🧪🧪🧪🧪🧪🧪🧪🧪🧪🧪🧪🧪🧪🧪🧪🧪🧪🧪🧪🧪🧪🧪🧪🧪🧪🧪🧪🧪🧪🧪🧪🧪🧪🧪🧪🧪🧪🧪🧪🧪🧪🧪🧪🧪🧪🧪🧪🧪🧪🧪🧪🧪🧪🧪🧪🧪🧪🧪🧪🧪🧪🧪🧪🧪🧪🧪🧪🧪🧪🧪🧪🧪🧪🧪🧪🧪🧪🧪🧪🧪🧪🧪🧪🧪🧪🧪🧪🧪🧪🧪🧪🧪🧪🧪🧪🧪🧪🧪🧪🧪🧪🧪🧪🧪🧪🧪🧪🧪🧪🧪🧪🧪🧪🧪🧪🧪🧪🧪🧪🧪🧪🧪🧪🧪🧪🧪🧪🧪🧪🧪🧪🧪🧪🧪🧪🧪🧪🧪🧪🧪🧪🧪🧪🧪🧪🧪🧪🧪🧪🧪🧪🧪🧪🧪🧪🧪🧪🧪🧪🧪🧪🧪🧪🧪🧪🧪🧪🧪🧪🧪🧪🧪🧪🧪🧪🧪🧪🧪🧪🧪🧪🧪🧪🧪🧪🧪🧪🧪🧪🧪🧪🧪🧪🧪🧪🧪🧪🧪🧪🧪🧪🧪🧪🧪🧪🧪🧪🧪🧪🧪🧪🧪🧪🧪🧪🧪🧪🧪🧪🧪🧪🧪🧪🧪🧪🧪🧪🧪🧪🧪🧪🧪🧪🧪🧪🧪🧪🧪🧪🧪🧪🧪🧪🧪🧪🧪🧪🧪🧪🧪🧪🧪🧪🧪🧪🧪🧪🧪🧪🧪🧪🧪🧪🧪🧪🧪🧪🧪🧪🧪🧪🧪🧪🧪🧪🧪🧪🧪🧪🧪🧪🧪🧪🧪🧪🧪🧪🧪🧪🧪🧪🧪🧪🧪🧪🧪🧪🧪🧪🧪🧪🧪🧪🧪🧪🧪🧪🧪🧪🧪🧪🧪🧪🧪🧪🧪🧪🧪🧪🧪🧪🧪🧪🧪🧪🧪🧪🧪🧪🧪🧪🧪🧪🧪🧪🧪🧪🧪🧪🧪🧪🧪🧪🧪🧪🧪🧪🧪🧪🧪🧪🧪🧪🧪🧪🧪🧪🧪🧪🧪🧪🧪🧪🧪🧪🧪🧪🧪🧪🧪🧪🧪🧪🧪🧪🧪🧪🧪🧪🧪🧪🧪🧪🧪🧪🧪🧪🧪🧪🧪🧪🧪🧪🧪🧪🧪🧪🧪🧪🧪🧪🧪🧪🧪🧪🧪🧪🧪🧪🧪🧪🧪🧪🧪🧪🧪🧪🧪🧪🧪🧪🧪🧪🧪🧪🧪🧪🧪🧪🧪🧪🧪🧪🧪🧪🧪🧪🧪🧪🧪🧪🧪🧪🧪🧪🧪🧪🧪🧪🧪🧪🧪🧪🧪🧪🧪🧪🧪🧪🧪🧪🧪🧪🧪🧪🧪🧪🧪🧪🧪🧪🧪🧪🧪🧪🧪🧪🧪🧪🧪🧪🧪🧪🧪🧪🧪🧪🧪🧪🧪🧪🧪🧪🧪🧪🧪🧪🧪🧪🧪🧪🧪🧪🧪🧪🧪🧪🧪🧪🧪🧪🧪🧪🧪🧪🧪🧪🧪🧪🧪🧪🧪🧪🧪🧪🧪🧪🧪🧪🧪🧪🧪🧪🧪🧪🧪🧪🧪🧪🧪🧪🧪🧪🧪🧪🧪🧪🧪🧪🧪🧪🧪🧪🧪🧪🧪🧪🧪🧪🧪🧪🧪🧪🧪🧪🧪🧪🧪🧪🧪🧪🧪🧪🧪🧪🧪🧪🧪🧪🧪🧪🧪🧪🧪🧪🧪🧪🧪🧪🧪🧪🧪🧪🧪🧪🧪🧪🧪🧪🧪🧪🧪🧪🧪🧪🧪🧪🧪🧪🧪🧪🧪🧪🧪🧪🧪🧪🧪🧪🧪🧪🧪🧪🧪🧪🧪🧪🧪🧪🧪🧪🧪🧪🧪🧪🧪🧪🧪🧪🧪🧪🧪🧪🧪🧪🧪🧪🧪🧪🧪🧪🧪🧪🧪🧪🧪🧪🧪🧪🧪🧪🧪🧪🧪🧪🧪🧪🧪🧪🧪🧪🧪🧪🧪🧪🧪🧪🧪🧪🧪🧪🧪🧪🧪🧪🧪🧪🧪🧪🧪🧪🧪🧪🧪🧪🧪🧪🧪🧪🧪🧪🧪🧪🧪🧪🧪🧪🧪🧪🧪🧪🧪🧪🧪🧪🧪🧪🧪🧪🧪🧪🧪🧪🧪🧪🧪🧪🧪🧪🧪🧪🧪🧪🧪🧪🧪🧪🧪🧪🧪🧪🧪🧪🧪🧪🧪🧪🧪🧪🧪🧪🧪🧪🧪🧪🧪🧪🧪🧪🧪🧪🧪🧪🧪🧪🧪🧪🧪🧪🧪🧪🧪🧪🧪🧪🧪🧪🧪🧪🧪🧪🧪🧪🧪🧪🧪🧪🧪🧪🧪🧪🧪🧪🧪🧪🧪🧪🧪🧪🧪🧪🧪🧪🧪🧪🧪🧪🧪🧪🧪🧪🧪🧪🧪🧪🧪🧪🧪🧪🧪🧪🧪🧪🧪🧪🧪🧪🧪🧪🧪🧪🧪🧪🧪🧪🧪🧪🧪🧪🧪🧪🧪🧪🧪🧪🧪🧪🧪🧪🧪🧪🧪🧪🧪🧪🧪🧪🧪🧪🧪🧪🧪🧪🧪🧪🧪🧪🧪🧪🧪🧪🧪🧪🧪🧪🧪🧪🧪🧪🧪🧪🧪🧪🧪🧪🧪🧪🧪🧪🧪🧪🧪🧪🧪🧪🧪🧪🧪🧪🧪🧪🧪🧪🧪🧪🧪🧪🧪🧪🧪🧪🧪🧪🧪🧪🧪🧪🧪🧪🧪🧪🧪🧪🧪🧪🧪🧪🧪🧪🧪🧪🧪🧪🧪🧪🧪🧪🧪🧪🧪🧪🧪🧪🧪🧪🧪🧪🧪🧪🧪🧪🧪🧪🧪🧪🧪🧪🧪🧪🧪🧪🧪🧪🧪🧪🧪🧪🧪🧪🧪🧪🧪🧪🧪🧪🧪🧪🧪🧪🧪🧪🧪🧪🧪🧪🧪🧪🧪🧪🧪🧪🧪🧪🧪🧪🧪🧪🧪🧪🧪🧪🧪🧪🧪🧪🧪🧪🧪🧪🧪🧪🧪🧪🧪🧪🧪🧪🧪🧪🧪🧪🧪🧪🧪🧪🧪🧪🧪🧪🧪🧪🧪🧪🧪🧪🧪🧪🧪🧪🧪🧪🧪🧪🧪🧪🧪🧪🧪🧪🧪🧪🧪🧪🧪🧪🧪🧪🧪🧪🧪🧪🧪🧪🧪🧪🧪🧪🧪🧪🧪🧪🧪🧪🧪🧪🧪🧪🧪🧪🧪🧪🧪🧪🧪🧪🧪🧪🧪🧪🧪🧪🧪🧪🧪🧪🧪🧪🧪🧪🧪🧪🧪🧪🧪🧪🧪🧪🧪🧪🧪🧪🧪🧪🧪🧪🧪🧪🧪🧪🧪🧪🧪🧪🧪🧪🧪🧪🧪🧪🧪🧪🧪🧪🧪🧪🧪🧪🧪🧪🧪🧪🧪🧪🧪🧪🧪🧪🧪🧪🧪🧪🧪🧪🧪🧪🧪🧪🧪🧪🧪🧪🧪🧪🧪🧪🧪🧪🧪🧪🧪🧪🧪🧪🧪🧪🧪🧪🧪🧪🧪🧪🧪🧪🧪🧪🧪🧪🧪🧪🧪🧪🧪🧪🧪🧪🧪🧪🧪🧪🧪🧪🧪🧪🧪🧪🧪🧪🧪🧪🧪🧪🧪🧪🧪🧪🧪🧪🧪🧪🧪🧪🧪🧪🧪🧪🧪🧪🧪🧪🧪🧪🧪🧪🧪🧪🧪🧪🧪🧪🧪🧪🧪🧪🧪🧪🧪🧪🧪🧪🧪🧪🧪🧪🧪🧪🧪🧪🧪🧪🧪🧪🧪🧪🧪🧪🧪🧪🧪🧪🧪🧪🧪🧪🧪🧪🧪🧪🧪🧪🧪🧪🧪🧪🧪🧪🧪🧪🧪🧪🧪🧪🧪🧪🧪🧪🧪🧪🧪🧪🧪🧪🧪🧪🧪🧪🧪🧪🧪🧪🧪🧪🧪🧪🧪🧪🧪🧪🧪🧪🧪🧪🧪🧪🧪🧪🧪🧪🧪🧪🧪🧪🧪🧪🧪🧪🧪🧪🧪🧪🧪🧪🧪🧪🧪🧪🧪🧪🧪🧪🧪🧪🧪🧪🧪🧪🧪🧪🧪🧪🧪🧪🧪🧪🧪🧪🧪🧪🧪🧪🧪🧪🧪🧪🧪🧪🧪🧪🧪🧪🧪🧪🧪🧪🧪🧪🧪🧪🧪🧪🧪🧪🧪🧪🧪🧪🧪🧪🧪🧪🧪🧪🧪🧪🧪🧪🧪🧪🧪🧪🧪🧪🧪🧪🧪🧪🧪🧪🧪🧪🧪🧪🧪🧪🧪🧪🧪🧪🧪🧪🧪🧪🧪🧪🧪🧪🧪🧪🧪🧪🧪🧪🧪🧪🧪🧪🧪🧪🧪🧪🧪🧪🧪🧪🧪🧪🧪🧪🧪🧪🧪🧪🧪🧪🧪🧪🧪🧪🧪🧪🧪🧪🧪🧪🧪🧪🧪🧪🧪🧪🧪🧪🧪🧪🧪🧪🧪🧪🧪🧪🧪🧪🧪🧪🧪🧪🧪🧪🧪🧪🧪🧪🧪🧪🧪🧪🧪🧪🧪🧪🧪🧪🧪🧪🧪🧪🧪🧪🧪🧪🧪🧪🧪🧪🧪🧪🧪🧪🧪🧪🧪🧪🧪🧪🧪🧪🧪🧪🧪🧪🧪🧪🧪🧪🧪🧪🧪🧪🧪🧪🧪🧪🧪🧪🧪🧪🧪🧪🧪🧪🧪🧪🧪🧪🧪🧪🧪🧪🧪🧪🧪🧪🧪🧪🧪🧪🧪🧪🧪🧪🧪🧪🧪🧪🧪🧪🧪🧪🧪🧪🧪🧪🧪🧪🧪🧪🧪🧪🧪🧪🧪🧪🧪🧪🧪🧪🧪🧪🧪🧪🧪🧪🧪🧪🧪🧪🧪🧪🧪🧪🧪🧪🧪🧪🧪🧪🧪🧪🧪🧪🧪🧪🧪🧪🧪🧪🧪🧪🧪🧪🧪🧪🧪🧪🧪🧪🧪🧪🧪🧪🧪🧪🧪🧪🧪🧪🧪🧪🧪🧪🧪🧪🧪🧪🧪🧪🧪🧪🧪🧪🧪🧪🧪🧪🧪🧪🧪🧪🧪🧪🧪🧪🧪🧪🧪🧪🧪🧪🧪🧪🧪🧪🧪🧪🧪🧪🧪🧪🧪🧪🧪🧪🧪🧪🧪🧪🧪🧪🧪🧪🧪","objective":"Huge objective 🧪🧪🧪🧪🧪🧪🧪🧪🧪🧪🧪🧪🧪🧪🧪🧪🧪🧪🧪🧪🧪🧪🧪🧪🧪🧪🧪🧪🧪🧪🧪🧪🧪🧪🧪🧪🧪🧪🧪🧪🧪🧪🧪🧪🧪🧪🧪🧪🧪🧪🧪🧪🧪🧪🧪🧪🧪🧪🧪🧪🧪🧪🧪🧪🧪🧪🧪🧪🧪🧪🧪🧪🧪🧪🧪🧪🧪🧪🧪🧪🧪🧪🧪🧪🧪🧪🧪🧪🧪🧪🧪🧪🧪🧪🧪🧪🧪🧪🧪🧪🧪🧪🧪🧪🧪🧪🧪🧪🧪🧪🧪🧪🧪🧪🧪🧪🧪🧪🧪🧪🧪🧪🧪🧪🧪🧪🧪🧪🧪🧪🧪🧪🧪🧪🧪🧪🧪🧪🧪🧪🧪🧪🧪🧪🧪🧪🧪🧪🧪🧪🧪🧪🧪🧪🧪🧪🧪🧪🧪🧪🧪🧪🧪🧪🧪🧪🧪🧪🧪🧪🧪🧪🧪🧪🧪🧪🧪🧪🧪🧪🧪🧪🧪🧪🧪🧪🧪🧪🧪🧪🧪🧪🧪🧪🧪🧪🧪🧪🧪🧪🧪🧪🧪🧪🧪🧪🧪🧪🧪🧪🧪🧪🧪🧪🧪🧪🧪🧪🧪🧪🧪🧪🧪🧪🧪🧪🧪🧪🧪🧪🧪🧪🧪🧪🧪🧪🧪🧪🧪🧪🧪🧪🧪🧪🧪🧪🧪🧪🧪🧪🧪🧪🧪🧪🧪🧪🧪🧪🧪🧪🧪🧪🧪🧪🧪🧪🧪🧪🧪🧪🧪🧪🧪🧪🧪🧪🧪🧪🧪🧪🧪🧪🧪🧪🧪🧪🧪🧪🧪🧪🧪🧪🧪🧪🧪🧪🧪🧪🧪🧪🧪🧪🧪🧪🧪🧪🧪🧪🧪🧪🧪🧪🧪🧪🧪🧪🧪🧪🧪🧪🧪🧪🧪🧪🧪🧪🧪🧪🧪🧪🧪🧪🧪🧪🧪🧪🧪🧪🧪🧪🧪🧪🧪🧪🧪🧪🧪🧪🧪🧪🧪🧪🧪🧪🧪🧪🧪🧪🧪🧪🧪🧪🧪🧪🧪🧪🧪🧪🧪🧪🧪🧪🧪🧪🧪🧪🧪🧪🧪🧪🧪🧪🧪🧪🧪🧪🧪🧪🧪🧪🧪🧪🧪🧪🧪🧪🧪🧪🧪🧪🧪🧪🧪🧪🧪🧪🧪🧪🧪🧪🧪🧪🧪🧪🧪🧪🧪🧪🧪🧪🧪🧪🧪🧪🧪🧪🧪🧪🧪🧪🧪🧪🧪🧪🧪🧪🧪🧪🧪🧪🧪🧪🧪🧪🧪🧪🧪🧪🧪🧪🧪🧪🧪🧪🧪🧪🧪🧪🧪🧪🧪🧪🧪🧪🧪🧪🧪🧪🧪🧪🧪🧪🧪🧪🧪🧪🧪🧪🧪🧪🧪🧪🧪🧪🧪🧪🧪🧪🧪🧪🧪🧪🧪🧪🧪🧪🧪🧪🧪🧪🧪🧪🧪🧪🧪🧪🧪🧪🧪🧪🧪🧪🧪🧪🧪🧪🧪🧪🧪🧪🧪🧪🧪🧪🧪🧪🧪🧪🧪🧪🧪🧪🧪🧪🧪🧪🧪🧪🧪🧪🧪🧪🧪🧪🧪🧪🧪🧪🧪🧪🧪🧪🧪🧪🧪🧪🧪🧪🧪🧪🧪🧪🧪🧪🧪🧪🧪🧪🧪🧪🧪🧪🧪🧪🧪🧪🧪🧪🧪🧪🧪🧪🧪🧪🧪🧪🧪🧪🧪🧪🧪🧪🧪🧪🧪🧪🧪🧪🧪🧪🧪🧪🧪🧪🧪🧪🧪🧪🧪🧪🧪🧪🧪🧪🧪🧪🧪🧪🧪🧪🧪🧪🧪🧪🧪🧪🧪🧪🧪🧪🧪🧪🧪🧪🧪🧪🧪🧪🧪🧪🧪🧪🧪🧪🧪🧪🧪🧪🧪🧪🧪🧪🧪🧪🧪🧪🧪🧪🧪🧪🧪🧪🧪🧪🧪🧪🧪🧪🧪🧪🧪🧪🧪🧪🧪🧪🧪🧪🧪🧪🧪🧪🧪🧪🧪🧪🧪🧪🧪🧪🧪🧪🧪🧪🧪🧪🧪🧪🧪🧪🧪🧪🧪🧪🧪🧪🧪🧪🧪🧪🧪🧪🧪🧪🧪🧪🧪🧪🧪🧪🧪🧪🧪🧪🧪🧪🧪🧪🧪🧪🧪🧪🧪🧪🧪🧪🧪🧪🧪🧪🧪🧪🧪🧪🧪🧪🧪🧪🧪🧪🧪🧪🧪🧪🧪🧪🧪🧪🧪🧪🧪🧪🧪🧪🧪🧪🧪🧪🧪🧪🧪🧪🧪🧪🧪🧪🧪🧪🧪🧪🧪🧪🧪🧪🧪🧪🧪🧪🧪🧪🧪🧪🧪🧪🧪🧪🧪🧪🧪🧪🧪🧪🧪🧪🧪🧪🧪🧪🧪🧪🧪🧪🧪🧪🧪🧪🧪🧪🧪🧪🧪🧪🧪🧪🧪🧪🧪🧪🧪🧪🧪🧪🧪🧪🧪🧪🧪🧪🧪🧪🧪🧪🧪🧪🧪🧪🧪🧪🧪🧪🧪🧪🧪🧪🧪🧪🧪🧪🧪🧪🧪🧪🧪🧪🧪🧪🧪🧪🧪🧪🧪🧪🧪🧪🧪🧪🧪🧪🧪🧪🧪🧪🧪🧪🧪🧪🧪🧪🧪🧪🧪🧪🧪🧪🧪🧪🧪🧪🧪🧪🧪🧪🧪🧪🧪🧪🧪🧪🧪🧪🧪🧪🧪🧪🧪🧪🧪🧪🧪🧪🧪🧪🧪🧪🧪🧪🧪🧪🧪🧪🧪🧪🧪🧪🧪🧪🧪🧪🧪🧪🧪🧪🧪🧪🧪🧪🧪🧪🧪🧪🧪🧪🧪🧪🧪🧪🧪🧪🧪🧪🧪🧪🧪🧪🧪🧪🧪🧪🧪🧪🧪🧪🧪🧪🧪🧪🧪🧪🧪🧪🧪🧪🧪🧪🧪🧪🧪🧪🧪🧪🧪🧪🧪🧪🧪🧪🧪🧪🧪🧪🧪🧪🧪🧪🧪🧪🧪🧪🧪🧪🧪🧪🧪🧪🧪🧪🧪🧪🧪🧪🧪🧪🧪🧪🧪🧪🧪🧪🧪🧪🧪🧪🧪🧪🧪🧪🧪🧪🧪🧪🧪🧪🧪🧪🧪🧪🧪🧪🧪🧪🧪🧪🧪🧪🧪🧪🧪🧪🧪🧪🧪🧪🧪🧪🧪🧪🧪🧪🧪🧪🧪🧪🧪🧪🧪🧪🧪🧪🧪🧪🧪🧪🧪🧪🧪🧪🧪🧪🧪🧪🧪🧪🧪🧪🧪🧪🧪🧪🧪🧪🧪🧪🧪🧪🧪🧪🧪🧪🧪🧪🧪🧪🧪🧪🧪🧪🧪🧪🧪🧪🧪🧪🧪🧪🧪🧪🧪🧪🧪🧪🧪🧪🧪🧪🧪🧪🧪🧪🧪🧪🧪🧪🧪🧪🧪🧪🧪🧪🧪🧪🧪🧪🧪🧪🧪🧪🧪🧪🧪🧪🧪🧪🧪🧪🧪🧪🧪🧪🧪🧪🧪🧪🧪🧪🧪🧪🧪🧪🧪🧪🧪🧪🧪🧪🧪🧪🧪🧪🧪🧪🧪🧪🧪🧪🧪🧪🧪🧪🧪🧪🧪🧪🧪🧪🧪🧪🧪🧪🧪🧪🧪🧪🧪🧪🧪🧪🧪🧪🧪🧪🧪🧪🧪🧪🧪🧪🧪🧪🧪🧪🧪🧪🧪🧪🧪🧪🧪🧪🧪🧪🧪🧪🧪🧪🧪🧪🧪🧪🧪🧪🧪🧪🧪🧪🧪🧪🧪🧪🧪🧪🧪🧪🧪🧪🧪🧪🧪🧪🧪🧪🧪🧪🧪🧪🧪🧪🧪🧪🧪🧪🧪🧪🧪🧪🧪🧪🧪🧪🧪🧪🧪🧪🧪🧪🧪🧪🧪🧪🧪🧪🧪🧪🧪🧪🧪🧪🧪🧪🧪🧪🧪🧪🧪🧪🧪🧪🧪🧪🧪🧪🧪🧪🧪🧪🧪🧪🧪🧪🧪🧪🧪🧪🧪🧪🧪🧪🧪🧪🧪🧪🧪🧪🧪🧪🧪🧪🧪🧪🧪🧪🧪🧪🧪🧪🧪🧪🧪🧪🧪🧪🧪🧪🧪🧪🧪🧪🧪🧪🧪🧪🧪🧪🧪🧪🧪🧪🧪🧪🧪🧪🧪🧪🧪🧪🧪🧪🧪🧪🧪🧪🧪🧪🧪🧪🧪🧪🧪🧪🧪🧪🧪🧪🧪🧪🧪🧪🧪🧪🧪🧪🧪🧪🧪🧪🧪🧪🧪🧪🧪🧪🧪🧪🧪🧪🧪🧪🧪🧪🧪🧪🧪🧪🧪🧪🧪🧪🧪🧪🧪🧪🧪🧪🧪🧪🧪🧪🧪🧪🧪🧪🧪🧪🧪🧪🧪🧪🧪🧪🧪🧪🧪🧪🧪🧪🧪🧪🧪🧪🧪🧪🧪🧪🧪🧪🧪🧪🧪🧪🧪🧪🧪🧪🧪🧪🧪🧪🧪🧪🧪🧪🧪🧪🧪🧪🧪🧪🧪🧪🧪🧪🧪🧪🧪🧪🧪🧪🧪🧪🧪🧪🧪🧪🧪🧪🧪🧪🧪🧪🧪🧪🧪🧪🧪🧪🧪🧪🧪🧪🧪🧪🧪🧪🧪🧪🧪🧪🧪🧪🧪🧪🧪🧪🧪🧪🧪🧪🧪🧪🧪🧪🧪🧪🧪🧪🧪🧪🧪🧪🧪🧪🧪🧪🧪🧪🧪🧪🧪🧪🧪🧪🧪🧪🧪🧪🧪🧪🧪🧪🧪🧪🧪🧪🧪🧪🧪🧪🧪🧪🧪🧪🧪🧪🧪🧪🧪🧪🧪🧪🧪🧪🧪🧪🧪🧪🧪🧪🧪🧪🧪🧪🧪🧪🧪🧪🧪🧪🧪🧪🧪🧪🧪🧪🧪🧪🧪🧪🧪🧪🧪🧪🧪🧪🧪🧪🧪🧪🧪🧪🧪🧪🧪🧪🧪🧪🧪🧪🧪🧪🧪🧪🧪🧪🧪🧪🧪🧪🧪🧪🧪🧪🧪🧪🧪🧪🧪🧪🧪🧪🧪🧪🧪🧪🧪🧪🧪🧪🧪🧪🧪🧪🧪🧪🧪🧪🧪🧪🧪🧪🧪🧪🧪🧪🧪🧪🧪🧪🧪🧪🧪🧪🧪🧪🧪🧪🧪🧪🧪🧪🧪🧪🧪🧪🧪🧪🧪🧪🧪🧪🧪🧪🧪🧪🧪🧪🧪🧪🧪🧪🧪🧪🧪🧪🧪🧪🧪🧪🧪🧪🧪🧪🧪🧪🧪🧪🧪🧪🧪🧪🧪🧪🧪🧪🧪🧪🧪🧪🧪🧪🧪🧪🧪🧪🧪🧪🧪🧪🧪🧪🧪🧪🧪🧪🧪🧪🧪🧪🧪🧪🧪🧪🧪🧪🧪🧪🧪🧪🧪🧪🧪🧪🧪🧪🧪🧪🧪🧪🧪🧪🧪🧪🧪🧪🧪🧪🧪🧪🧪🧪🧪🧪🧪🧪🧪🧪🧪🧪🧪🧪🧪🧪🧪🧪🧪🧪🧪🧪🧪🧪🧪🧪🧪🧪🧪🧪🧪🧪🧪🧪🧪🧪🧪🧪🧪🧪🧪🧪🧪🧪🧪🧪🧪🧪🧪🧪🧪🧪🧪🧪🧪🧪🧪🧪🧪🧪🧪🧪🧪🧪🧪🧪🧪🧪🧪🧪🧪🧪🧪🧪🧪🧪🧪🧪🧪🧪🧪🧪🧪🧪🧪🧪🧪🧪🧪🧪🧪🧪🧪🧪🧪🧪🧪🧪🧪🧪🧪🧪🧪🧪🧪🧪🧪🧪🧪🧪🧪🧪🧪🧪🧪🧪🧪🧪🧪🧪🧪🧪🧪🧪🧪🧪🧪🧪🧪🧪🧪🧪🧪🧪🧪🧪🧪🧪🧪🧪🧪🧪🧪🧪🧪🧪🧪🧪🧪🧪🧪🧪🧪🧪🧪🧪🧪🧪🧪🧪🧪🧪🧪🧪🧪🧪🧪🧪🧪🧪🧪🧪🧪🧪🧪🧪🧪🧪🧪🧪🧪🧪🧪🧪🧪🧪🧪🧪🧪🧪🧪🧪🧪🧪🧪🧪","scope":{"in":["artifact.txt"],"out":["deployment"]},"constraints":["local-only"],"acceptance_criteria":[{"criterion_id":"criterion-01-🧪🧪🧪🧪🧪🧪🧪🧪🧪🧪🧪🧪🧪🧪🧪🧪🧪🧪🧪🧪🧪🧪🧪🧪🧪🧪🧪🧪🧪🧪🧪🧪🧪🧪🧪🧪🧪🧪🧪🧪🧪🧪🧪🧪🧪🧪🧪🧪🧪🧪🧪🧪🧪🧪🧪🧪🧪🧪🧪🧪🧪🧪🧪🧪🧪🧪🧪🧪🧪🧪🧪🧪🧪🧪🧪🧪🧪🧪🧪🧪🧪🧪🧪🧪🧪🧪🧪🧪🧪🧪🧪🧪🧪🧪🧪🧪🧪🧪🧪🧪","statement":"Verify huge criterion 1","verification":"mechanical"},{"criterion_id":"criterion-02-🧪🧪🧪🧪🧪🧪🧪🧪🧪🧪🧪🧪🧪🧪🧪🧪🧪🧪🧪🧪🧪🧪🧪🧪🧪🧪🧪🧪🧪🧪🧪🧪🧪🧪🧪🧪🧪🧪🧪🧪🧪🧪🧪🧪🧪🧪🧪🧪🧪🧪🧪🧪🧪🧪🧪🧪🧪🧪🧪🧪🧪🧪🧪🧪🧪🧪🧪🧪🧪🧪🧪🧪🧪🧪🧪🧪🧪🧪🧪🧪🧪🧪🧪🧪🧪🧪🧪🧪🧪🧪🧪🧪🧪🧪🧪🧪🧪🧪🧪🧪","statement":"Verify huge criterion 2","verification":"mechanical"},{"criterion_id":"criterion-03-🧪🧪🧪🧪🧪🧪🧪🧪🧪🧪🧪🧪🧪🧪🧪🧪🧪🧪🧪🧪🧪🧪🧪🧪🧪🧪🧪🧪🧪🧪🧪🧪🧪🧪🧪🧪🧪🧪🧪🧪🧪🧪🧪🧪🧪🧪🧪🧪🧪🧪🧪🧪🧪🧪🧪🧪🧪🧪🧪🧪🧪🧪🧪🧪🧪🧪🧪🧪🧪🧪🧪🧪🧪🧪🧪🧪🧪🧪🧪🧪🧪🧪🧪🧪🧪🧪🧪🧪🧪🧪🧪🧪🧪🧪🧪🧪🧪🧪🧪🧪","statement":"Verify huge criterion 3","verification":"mechanical"},{"criterion_id":"criterion-04-🧪🧪🧪🧪🧪🧪🧪🧪🧪🧪🧪🧪🧪🧪🧪🧪🧪🧪🧪🧪🧪🧪🧪🧪🧪🧪🧪🧪🧪🧪🧪🧪🧪🧪🧪🧪🧪🧪🧪🧪🧪🧪🧪🧪🧪🧪🧪🧪🧪🧪🧪🧪🧪🧪🧪🧪🧪🧪🧪🧪🧪🧪🧪🧪🧪🧪🧪🧪🧪🧪🧪🧪🧪🧪🧪🧪🧪🧪🧪🧪🧪🧪🧪🧪🧪🧪🧪🧪🧪🧪🧪🧪🧪🧪🧪🧪🧪🧪🧪🧪","statement":"Verify huge criterion 4","verification":"mechanical"},{"criterion_id":"criterion-05-🧪🧪🧪🧪🧪🧪🧪🧪🧪🧪🧪🧪🧪🧪🧪🧪🧪🧪🧪🧪🧪🧪🧪🧪🧪🧪🧪🧪🧪🧪🧪🧪🧪🧪🧪🧪🧪🧪🧪🧪🧪🧪🧪🧪🧪🧪🧪🧪🧪🧪🧪🧪🧪🧪🧪🧪🧪🧪🧪🧪🧪🧪🧪🧪🧪🧪🧪🧪🧪🧪🧪🧪🧪🧪🧪🧪🧪🧪🧪🧪🧪🧪🧪🧪🧪🧪🧪🧪🧪🧪🧪🧪🧪🧪🧪🧪🧪🧪🧪🧪","statement":"Verify huge criterion 5","verification":"mechanical"},{"criterion_id":"criterion-06-🧪🧪🧪🧪🧪🧪🧪🧪🧪🧪🧪🧪🧪🧪🧪🧪🧪🧪🧪🧪🧪🧪🧪🧪🧪🧪🧪🧪🧪🧪🧪🧪🧪🧪🧪🧪🧪🧪🧪🧪🧪🧪🧪🧪🧪🧪🧪🧪🧪🧪🧪🧪🧪🧪🧪🧪🧪🧪🧪🧪🧪🧪🧪🧪🧪🧪🧪🧪🧪🧪🧪🧪🧪🧪🧪🧪🧪🧪🧪🧪🧪🧪🧪🧪🧪🧪🧪🧪🧪🧪🧪🧪🧪🧪🧪🧪🧪🧪🧪🧪","statement":"Verify huge criterion 6","verification":"mechanical"},{"criterion_id":"criterion-07-🧪🧪🧪🧪🧪🧪🧪🧪🧪🧪🧪🧪🧪🧪🧪🧪🧪🧪🧪🧪🧪🧪🧪🧪🧪🧪🧪🧪🧪🧪🧪🧪🧪🧪🧪🧪🧪🧪🧪🧪🧪🧪🧪🧪🧪🧪🧪🧪🧪🧪🧪🧪🧪🧪🧪🧪🧪🧪🧪🧪🧪🧪🧪🧪🧪🧪🧪🧪🧪🧪🧪🧪🧪🧪🧪🧪🧪🧪🧪🧪🧪🧪🧪🧪🧪🧪🧪🧪🧪🧪🧪🧪🧪🧪🧪🧪🧪🧪🧪🧪","statement":"Verify huge criterion 7","verification":"mechanical"},{"criterion_id":"criterion-08-🧪🧪🧪🧪🧪🧪🧪🧪🧪🧪🧪🧪🧪🧪🧪🧪🧪🧪🧪🧪🧪🧪🧪🧪🧪🧪🧪🧪🧪🧪🧪🧪🧪🧪🧪🧪🧪🧪🧪🧪🧪🧪🧪🧪🧪🧪🧪🧪🧪🧪🧪🧪🧪🧪🧪🧪🧪🧪🧪🧪🧪🧪🧪🧪🧪🧪🧪🧪🧪🧪🧪🧪🧪🧪🧪🧪🧪🧪🧪🧪🧪🧪🧪🧪🧪🧪🧪🧪🧪🧪🧪🧪🧪🧪🧪🧪🧪🧪🧪🧪","statement":"Verify huge criterion 8","verification":"mechanical"},{"criterion_id":"criterion-09-🧪🧪🧪🧪🧪🧪🧪🧪🧪🧪🧪🧪🧪🧪🧪🧪🧪🧪🧪🧪🧪🧪🧪🧪🧪🧪🧪🧪🧪🧪🧪🧪🧪🧪🧪🧪🧪🧪🧪🧪🧪🧪🧪🧪🧪🧪🧪🧪🧪🧪🧪🧪🧪🧪🧪🧪🧪🧪🧪🧪🧪🧪🧪🧪🧪🧪🧪🧪🧪🧪🧪🧪🧪🧪🧪🧪🧪🧪🧪🧪🧪🧪🧪🧪🧪🧪🧪🧪🧪🧪🧪🧪🧪🧪🧪🧪🧪🧪🧪🧪","statement":"Verify huge criterion 9","verification":"mechanical"},{"criterion_id":"criterion-10-🧪🧪🧪🧪🧪🧪🧪🧪🧪🧪🧪🧪🧪🧪🧪🧪🧪🧪🧪🧪🧪🧪🧪🧪🧪🧪🧪🧪🧪🧪🧪🧪🧪🧪🧪🧪🧪🧪🧪🧪🧪🧪🧪🧪🧪🧪🧪🧪🧪🧪🧪🧪🧪🧪🧪🧪🧪🧪🧪🧪🧪🧪🧪🧪🧪🧪🧪🧪🧪🧪🧪🧪🧪🧪🧪🧪🧪🧪🧪🧪🧪🧪🧪🧪🧪🧪🧪🧪🧪🧪🧪🧪🧪🧪🧪🧪🧪🧪🧪🧪","statement":"Verify huge criterion 10","verification":"mechanical"},{"criterion_id":"criterion-11-🧪🧪🧪🧪🧪🧪🧪🧪🧪🧪🧪🧪🧪🧪🧪🧪🧪🧪🧪🧪🧪🧪🧪🧪🧪🧪🧪🧪🧪🧪🧪🧪🧪🧪🧪🧪🧪🧪🧪🧪🧪🧪🧪🧪🧪🧪🧪🧪🧪🧪🧪🧪🧪🧪🧪🧪🧪🧪🧪🧪🧪🧪🧪🧪🧪🧪🧪🧪🧪🧪🧪🧪🧪🧪🧪🧪🧪🧪🧪🧪🧪🧪🧪🧪🧪🧪🧪🧪🧪🧪🧪🧪🧪🧪🧪🧪🧪🧪🧪🧪","statement":"Verify huge criterion 11","verification":"mechanical"},{"criterion_id":"criterion-12-🧪🧪🧪🧪🧪🧪🧪🧪🧪🧪🧪🧪🧪🧪🧪🧪🧪🧪🧪🧪🧪🧪🧪🧪🧪🧪🧪🧪🧪🧪🧪🧪🧪🧪🧪🧪🧪🧪🧪🧪🧪🧪🧪🧪🧪🧪🧪🧪🧪🧪🧪🧪🧪🧪🧪🧪🧪🧪🧪🧪🧪🧪🧪🧪🧪🧪🧪🧪🧪🧪🧪🧪🧪🧪🧪🧪🧪🧪🧪🧪🧪🧪🧪🧪🧪🧪🧪🧪🧪🧪🧪🧪🧪🧪🧪🧪🧪🧪🧪🧪","statement":"Verify huge criterion 12","verification":"mechanical"},{"criterion_id":"criterion-13-🧪🧪🧪🧪🧪🧪🧪🧪🧪🧪🧪🧪🧪🧪🧪🧪🧪🧪🧪🧪🧪🧪🧪🧪🧪🧪🧪🧪🧪🧪🧪🧪🧪🧪🧪🧪🧪🧪🧪🧪🧪🧪🧪🧪🧪🧪🧪🧪🧪🧪🧪🧪🧪🧪🧪🧪🧪🧪🧪🧪🧪🧪🧪🧪🧪🧪🧪🧪🧪🧪🧪🧪🧪🧪🧪🧪🧪🧪🧪🧪🧪🧪🧪🧪🧪🧪🧪🧪🧪🧪🧪🧪🧪🧪🧪🧪🧪🧪🧪🧪","statement":"Verify huge criterion 13","verification":"mechanical"},{"criterion_id":"criterion-14-🧪🧪🧪🧪🧪🧪🧪🧪🧪🧪🧪🧪🧪🧪🧪🧪🧪🧪🧪🧪🧪🧪🧪🧪🧪🧪🧪🧪🧪🧪🧪🧪🧪🧪🧪🧪🧪🧪🧪🧪🧪🧪🧪🧪🧪🧪🧪🧪🧪🧪🧪🧪🧪🧪🧪🧪🧪🧪🧪🧪🧪🧪🧪🧪🧪🧪🧪🧪🧪🧪🧪🧪🧪🧪🧪🧪🧪🧪🧪🧪🧪🧪🧪🧪🧪🧪🧪🧪🧪🧪🧪🧪🧪🧪🧪🧪🧪🧪🧪🧪","statement":"Verify huge criterion 14","verification":"mechanical"},{"criterion_id":"criterion-15-🧪🧪🧪🧪🧪🧪🧪🧪🧪🧪🧪🧪🧪🧪🧪🧪🧪🧪🧪🧪🧪🧪🧪🧪🧪🧪🧪🧪🧪🧪🧪🧪🧪🧪🧪🧪🧪🧪🧪🧪🧪🧪🧪🧪🧪🧪🧪🧪🧪🧪🧪🧪🧪🧪🧪🧪🧪🧪🧪🧪🧪🧪🧪🧪🧪🧪🧪🧪🧪🧪🧪🧪🧪🧪🧪🧪🧪🧪🧪🧪🧪🧪🧪🧪🧪🧪🧪🧪🧪🧪🧪🧪🧪🧪🧪🧪🧪🧪🧪🧪","statement":"Verify huge criterion 15","verification":"mechanical"},{"criterion_id":"criterion-16-🧪🧪🧪🧪🧪🧪🧪🧪🧪🧪🧪🧪🧪🧪🧪🧪🧪🧪🧪🧪🧪🧪🧪🧪🧪🧪🧪🧪🧪🧪🧪🧪🧪🧪🧪🧪🧪🧪🧪🧪🧪🧪🧪🧪🧪🧪🧪🧪🧪🧪🧪🧪🧪🧪🧪🧪🧪🧪🧪🧪🧪🧪🧪🧪🧪🧪🧪🧪🧪🧪🧪🧪🧪🧪🧪🧪🧪🧪🧪🧪🧪🧪🧪🧪🧪🧪🧪🧪🧪🧪🧪🧪🧪🧪🧪🧪🧪🧪🧪🧪","statement":"Verify huge criterion 16","verification":"mechanical"},{"criterion_id":"criterion-17-🧪🧪🧪🧪🧪🧪🧪🧪🧪🧪🧪🧪🧪🧪🧪🧪🧪🧪🧪🧪🧪🧪🧪🧪🧪🧪🧪🧪🧪🧪🧪🧪🧪🧪🧪🧪🧪🧪🧪🧪🧪🧪🧪🧪🧪🧪🧪🧪🧪🧪🧪🧪🧪🧪🧪🧪🧪🧪🧪🧪🧪🧪🧪🧪🧪🧪🧪🧪🧪🧪🧪🧪🧪🧪🧪🧪🧪🧪🧪🧪🧪🧪🧪🧪🧪🧪🧪🧪🧪🧪🧪🧪🧪🧪🧪🧪🧪🧪🧪🧪","statement":"Verify huge criterion 17","verification":"mechanical"},{"criterion_id":"criterion-18-🧪🧪🧪🧪🧪🧪🧪🧪🧪🧪🧪🧪🧪🧪🧪🧪🧪🧪🧪🧪🧪🧪🧪🧪🧪🧪🧪🧪🧪🧪🧪🧪🧪🧪🧪🧪🧪🧪🧪🧪🧪🧪🧪🧪🧪🧪🧪🧪🧪🧪🧪🧪🧪🧪🧪🧪🧪🧪🧪🧪🧪🧪🧪🧪🧪🧪🧪🧪🧪🧪🧪🧪🧪🧪🧪🧪🧪🧪🧪🧪🧪🧪🧪🧪🧪🧪🧪🧪🧪🧪🧪🧪🧪🧪🧪🧪🧪🧪🧪🧪","statement":"Verify huge criterion 18","verification":"mechanical"},{"criterion_id":"criterion-19-🧪🧪🧪🧪🧪🧪🧪🧪🧪🧪🧪🧪🧪🧪🧪🧪🧪🧪🧪🧪🧪🧪🧪🧪🧪🧪🧪🧪🧪🧪🧪🧪🧪🧪🧪🧪🧪🧪🧪🧪🧪🧪🧪🧪🧪🧪🧪🧪🧪🧪🧪🧪🧪🧪🧪🧪🧪🧪🧪🧪🧪🧪🧪🧪🧪🧪🧪🧪🧪🧪🧪🧪🧪🧪🧪🧪🧪🧪🧪🧪🧪🧪🧪🧪🧪🧪🧪🧪🧪🧪🧪🧪🧪🧪🧪🧪🧪🧪🧪🧪","statement":"Verify huge criterion 19","verification":"mechanical"},{"criterion_id":"criterion-20-🧪🧪🧪🧪🧪🧪🧪🧪🧪🧪🧪🧪🧪🧪🧪🧪🧪🧪🧪🧪🧪🧪🧪🧪🧪🧪🧪🧪🧪🧪🧪🧪🧪🧪🧪🧪🧪🧪🧪🧪🧪🧪🧪🧪🧪🧪🧪🧪🧪🧪🧪🧪🧪🧪🧪🧪🧪🧪🧪🧪🧪🧪🧪🧪🧪🧪🧪🧪🧪🧪🧪🧪🧪🧪🧪🧪🧪🧪🧪🧪🧪🧪🧪🧪🧪🧪🧪🧪🧪🧪🧪🧪🧪🧪🧪🧪🧪🧪🧪🧪","statement":"Verify huge criterion 20","verification":"mechanical"},{"criterion_id":"criterion-21-🧪🧪🧪🧪🧪🧪🧪🧪🧪🧪🧪🧪🧪🧪🧪🧪🧪🧪🧪🧪🧪🧪🧪🧪🧪🧪🧪🧪🧪🧪🧪🧪🧪🧪🧪🧪🧪🧪🧪🧪🧪🧪🧪🧪🧪🧪🧪🧪🧪🧪🧪🧪🧪🧪🧪🧪🧪🧪🧪🧪🧪🧪🧪🧪🧪🧪🧪🧪🧪🧪🧪🧪🧪🧪🧪🧪🧪🧪🧪🧪🧪🧪🧪🧪🧪🧪🧪🧪🧪🧪🧪🧪🧪🧪🧪🧪🧪🧪🧪🧪","statement":"Verify huge criterion 21","verification":"mechanical"}],"state_revision":"0","state_digest":"sha256:3e6622952fd5bf8dcd7439a08e02fcf342631fb2594cc55c9b287e57070405ee","last_operation":null,"active_run":{"run_id":"case-run-1","actor_id":"actor-a","started_by_handoff_id":null},"evidence":[],"current_handoff_id":null,"current_submission_id":null,"current_decision_id":null}
