{"dossier_id":"case-dossier-1","title":"Release integrity","objective":"Keep artifact current","scope":{"in":["artifact.txt"],"out":["deployment"]},"constraints":["local-only"],"acceptance_criteria":[{"criterion_id":"criterion-a","statement":"Artifact digest matches","verification":"mechanical"}],"state_revision":"10","state_digest":"sha256:39d9d7f5a70ceaf3bbc3eb1adb2f66cb6c24f402dc8d3811997aee07f2fb63a9","last_operation":{"operation_id":"op-history-advance","input_digest":"sha256:7777777777777777777777777777777777777777777777777777777777777777","basis_revision":"9","resulting_revision":"10"},"active_run":{"run_id":"case-run-1","actor_id":"actor-a","started_by_handoff_id":null},"evidence":[],"current_handoff_id":null,"current_submission_id":null,"current_decision_id":null}
