{"dossier_id":"case-dossier-1","title":"Bounded human view 20","objective":"Resume with bounded criteria","scope":{"in":["artifact.txt"],"out":["deployment"]},"constraints":["local-only"],"acceptance_criteria":[{"criterion_id":"criterion-01","statement":"Verify criterion 01","verification":"mechanical"},{"criterion_id":"criterion-02","statement":"Verify criterion 02","verification":"mechanical"},{"criterion_id":"criterion-03","statement":"Verify criterion 03","verification":"mechanical"},{"criterion_id":"criterion-04","statement":"Verify criterion 04","verification":"mechanical"},{"criterion_id":"criterion-05","statement":"Verify criterion 05","verification":"mechanical"},{"criterion_id":"criterion-06","statement":"Verify criterion 06","verification":"mechanical"},{"criterion_id":"criterion-07","statement":"Verify criterion 07","verification":"mechanical"},{"criterion_id":"criterion-08","statement":"Verify criterion 08","verification":"mechanical"},{"criterion_id":"criterion-09","statement":"Verify criterion 09","verification":"mechanical"},{"criterion_id":"criterion-10","statement":"Verify criterion 10","verification":"mechanical"},{"criterion_id":"criterion-11","statement":"Verify criterion 11","verification":"mechanical"},{"criterion_id":"criterion-12","statement":"Verify criterion 12","verification":"mechanical"},{"criterion_id":"criterion-13","statement":"Verify criterion 13","verification":"mechanical"},{"criterion_id":"criterion-14","statement":"Verify criterion 14","verification":"mechanical"},{"criterion_id":"criterion-15","statement":"Verify criterion 15","verification":"mechanical"},{"criterion_id":"criterion-16","statement":"Verify criterion 16","verification":"mechanical"},{"criterion_id":"criterion-17","statement":"Verify criterion 17","verification":"mechanical"},{"criterion_id":"criterion-18","statement":"Verify criterion 18","verification":"mechanical"},{"criterion_id":"criterion-19","statement":"Verify criterion 19","verification":"mechanical"},{"criterion_id":"criterion-20","statement":"Verify criterion 20","verification":"mechanical"}],"state_revision":"0","state_digest":"sha256:735426045650f26739e0c0db2bd78ec21146891399131bf144bb17e97604acc3","last_operation":null,"active_run":{"run_id":"case-run-1","actor_id":"actor-a","started_by_handoff_id":null},"evidence":[],"current_handoff_id":null,"current_submission_id":null,"current_decision_id":null}
